{
  "schema": 1,
  "components": [
    {
      "name": "msk_containers",
      "disposition": "deployed",
      "destination": {
        "root": "xdg_data_home",
        "path": "mkchad/components/msk_containers"
      },
      "actions": [
        {
          "id": "host-tools-check",
          "path": "bin/install_nvim.sh",
          "args": ["--check"]
        },
        {
          "id": "host-tools-install",
          "path": "bin/install_nvim.sh",
          "args": ["--recovery-dir", {"token": "recovery_dir"}]
        },
        {
          "id": "image-install",
          "path": "nvim/bin/install_nvim_container",
          "args": [
            "--source-revision",
            {"token": "component_revision"},
            {"token": "staged_image"}
          ]
        }
      ]
    },
    {
      "name": "mkchad",
      "disposition": "deployed",
      "destination": {
        "root": "xdg_config_home",
        "path": "mkchad"
      },
      "actions": []
    },
    {
      "name": "opencode",
      "disposition": "embedded"
    },
    {
      "name": "opencode.nvim",
      "disposition": "configuration-owned"
    },
    {
      "name": "opencode-project-reload",
      "disposition": "configuration-owned"
    },
    {
      "name": "compound-engineering",
      "disposition": "configuration-owned"
    },
    {
      "name": "opencode_sprint_loop",
      "disposition": "disabled"
    }
  ],
  "artifacts": {
    "nvim-image": [
      {
        "architecture": "x86_64",
        "sha256": "7b92ae19ed5564941f20314acb733506f4c9905bc32013fd1c807ae396f32a72",
        "component_manifest_sha256": "23fda86b5df886dfddb8e40de3bdda8ab30b8495aae920d160565608fc8937f8",
        "source_filename_class": "raw-nvim-container"
      }
    ]
  },
  "configuration": {
    "contract_version": 1,
    "guidance": "docs/deployment/configuration-contract-v1.md"
  }
}
